"id","nombre_negocio","ciudad_departamento","tipo_negocio","telefono_whatsapp","red_social_web","canal_disponible","prioridad_A_B_C","señal_demanda","problema_probable","oportunidad_barberai","estado","fuente_o_evidencia","observaciones"
"AT16-015","Melissa Beauty Salon","Tela / Atlantida","Salon de belleza","No encontrado publicamente","No encontrado publicamente","no encontrado","B","Ficha publica de beauty salon en Tela","Ordenar citas por servicio y responder consultas","Ordenar citas por servicio y responder consultas","Pendiente","OpenStreetMap / Overpass - https://www.openstreetmap.org/node/4201307331","Contacto no encontrado en fuente consultada."
"AT16-016","Diva's Salon","Tela / Atlantida","Salon / hairdresser","No encontrado publicamente","No encontrado publicamente","no encontrado","C","Ficha publica de hairdresser en Tela","Responder horarios servicios y disponibilidad","Responder horarios servicios y disponibilidad","Pendiente","OpenStreetMap / Overpass - https://www.openstreetmap.org/node/4201307342","Nombre en fuente aparece como Diva's Silon; validar escritura antes de outreach."
"AT16-017","Sary's","Tela / Atlantida","Salon de belleza","No encontrado publicamente","No encontrado publicamente","no encontrado","C","Ficha publica de negocio beauty en Tela","Ordenar citas y consultas frecuentes","Ordenar citas y consultas frecuentes","Pendiente","OpenStreetMap / Overpass - https://www.openstreetmap.org/node/4205990294","Contacto no encontrado en fuente consultada."
"AT16-018","Barberia Mary","Tela / Atlantida","Barberia","No encontrado publicamente","No encontrado publicamente","no encontrado","B","Ficha publica de barberia en Tela","Responder horarios servicios y disponibilidad","Responder horarios servicios y disponibilidad","Pendiente","OpenStreetMap / Overpass - https://www.openstreetmap.org/way/419991756","Contacto no encontrado en fuente consultada."
"AT16-019","Barberia Lesly","Tela / Atlantida","Barberia","No encontrado publicamente","No encontrado publicamente","no encontrado","B","Ficha publica de barberia en Tela","Responder consultas de ubicacion servicios y citas","Responder consultas de ubicacion servicios y citas","Pendiente","OpenStreetMap / Overpass - https://www.openstreetmap.org/way/420889975","Contacto no encontrado en fuente consultada."
"AT16-020","Sala de Belleza Daysi","Tela / Atlantida","Salon de belleza","No encontrado publicamente","No encontrado publicamente","no encontrado","B","Ficha publica de sala de belleza en Tela","Responder disponibilidad horarios servicios y citas","Responder disponibilidad horarios servicios y citas","Pendiente","OpenStreetMap / Overpass - https://www.openstreetmap.org/way/420895235","Contacto no encontrado en fuente consultada."
